ObjectName,FieldName,Metadata
SVMXC__Installed_Product__c,SVMXC__SM_External_Product__c,SM External Product Product (External) External system unique ID of the product related to installed product
SVMXC__Installed_Product__c,SVMXC__SM_External_Site__c,SM External Site Location (External) External system unique ID of the location related to the installed product.
SVMXC__Installed_Product__c,SVMXC__SM_External_Top_Level__c,SM External Top Level Top-Level (External) External system unique ID to the top level installed product in the installed product hierarchy.
SVMXC__Installed_Product__c,SVMXC__SM_Batch_Lot2__c,SM Batch Lot2 Batch/Lot Identification number assigned to a specific quantity or lot of materials from a single manufacturer.
SVMXC__Installed_Product__c,SVMXC__SM_Sales_Price__c,SM Sales Price Sales Price Sales Price